{"scenario_id":"manufacturing-conflicting-current-evidence-v1","evaluation_time":"2026-07-17T00:00:00Z","identity_continuity":"VERIFIED","package_integrity":"PASS","package_health_status":"FRESH","conflict_status":"ACTIVE_CONFLICT","claim_support":"CONFLICTED","claim_truth":"NOT_DETERMINED","fraud_assessment":"NOT_ESTABLISHED","evidence_assessment":[{"evidence_id":"evidence-s2-current-conformity","s_class":"S2","provenance":"VERIFIED","freshness":"CURRENT","subject_scope":"MATCH","direction":"SUPPORTS","population_scope":"LIMITED","limitations":["Atlas signature and canonical artifact hash verify against the supplied Atlas authority.","The assessment sampled only eight issuer-selected units from lots NMC-260601 and NMC-260615 during a scheduled factory assessment.","Zero nonconforming units supports conformity only within the assessed process and sample scope, not every unit released during the claim window.","The package does not provide individual measurements, calibration records, or detailed measurement procedures for independent arithmetic and method review.","Atlas provided a paid certification service; signature validity establishes provenance, not universal conformity."]},{"evidence_id":"evidence-s3-market-sample","s_class":"S3","provenance":"VERIFIED","freshness":"CURRENT","subject_scope":"MATCH","direction":"CONTRADICTS","population_scope":"LIMITED","limitations":["Meridian signature and canonical artifact hash verify against the supplied Meridian authority.","The report concerns the exact model and units from lots NMC-260601, NMC-260615, and NMC-260628 acquired during the claim window.","Against the inclusive tolerance interval 49.070–49.090 mm, four reported measurements are outside tolerance: 49.094, 49.096, 49.069, and 49.067 mm.","The twelve-unit market sample directly contradicts conformity for sampled units but cannot establish a population-wide failure rate.","Custody and credential checks are asserted in the report, while underlying purchase, transfer, credential, calibration, and raw measurement records require access and recheck."]}],"conflict_analysis":{"same_subject":true,"overlapping_time_window":true,"resolution_status":"UNRESOLVED","why_not_resolved":["Both current signed artifacts address NMC-NA4908 and include overlapping lots within the claim window.","The supporting factory assessment and contradicting market sample are each bounded samples with different selection contexts.","A valid issuer signature does not enlarge the Atlas assessment to universal production or invalidate Meridian's later observations.","The package contains no withdrawal, correction, adjudication, or evidence showing that either report is invalid.","The evidence cannot be averaged into a pass, and the market sample cannot be generalized into a population-wide failure rate."]},"risk_gaps":["Underlying S3 purchase, credential, custody-transfer, calibration, and raw measurement records have not been independently reviewed.","S2 individual measurements, calibration records, measurement procedure, and selection rationale are not supplied.","Evidence covers only three identified lots and does not establish conformity or nonconformity for all production released from 2026-06-01 through 2026-07-17.","No documented organization response, root-cause analysis, correction, or disposition reconciles the four sampled nonconformities.","No signed publication-history lockfile or carrier receipts are included, although current package integrity and identity verification pass."],"next_checks":[{"priority":1,"target_gaps":["S3_PROVENANCE_AND_CUSTODY"],"cost_level":"LOW","action":"Obtain and verify Meridian's existing distributor receipts, unit credentials, custody log, calibration records, and raw measurement records against report MRMS-NMC-2026-019.","reason":"This tests the provenance and measurement basis of the directly contradicting observations before commissioning new samples."},{"priority":2,"target_gaps":["S2_ISSUER_SCOPE_AND_METHOD"],"cost_level":"LOW","action":"Obtain Atlas's existing unit-level readings, instrument calibration records, measurement procedure, and issuer selection records for APC-NMC-2026-071.","reason":"This determines whether the supporting assessment's method and bounded scope are accurately represented."},{"priority":3,"target_gaps":["SUBJECT_BATCH_AND_TIME_ALIGNMENT"],"cost_level":"LOW","action":"Reconcile serial or unit credentials, release dates, and lot records for all twenty assessed or sampled units, especially overlapping lots NMC-260601 and NMC-260615.","reason":"Exact unit and release-date alignment can reveal whether both reports truly test production within the claimed release window."},{"priority":4,"target_gaps":["ORGANIZATION_RESPONSE_OR_CORRECTION"],"cost_level":"LOW","action":"Request Northstar's documented response, investigation, containment actions, and any corrections or withdrawals concerning the four Meridian out-of-tolerance results.","reason":"An existing response may resolve whether the conflicting observations were confirmed, explained, or corrected."},{"priority":5,"target_gaps":["BOUNDED_REPEAT_SAMPLING"],"cost_level":"MODERATE","action":"If documentary checks do not resolve the conflict, commission a preregistered independent repeat sample across additional current lots and distributors with sealed custody and retained raw measurements.","reason":"Bounded repeat sampling can reduce uncertainty without treating a small sample as a universal population estimate."}],"artifact_refs":["/verify/claims/product-claims.json#claim-current-dimensional-conformity","/verify/evidence/evidence-manifest.json#evidence-s2-current-conformity","/verify/evidence-artifacts/s2-current-conformity-report.json#APC-NMC-2026-071","/verify/issuers/atlas/s2-current-conformity-report.json.sig","/verify/issuers/atlas/root-authority.json","/verify/evidence/evidence-manifest.json#evidence-s3-market-sample","/verify/evidence-artifacts/s3-random-market-sample-report.json#MRMS-NMC-2026-019","/verify/issuers/meridian/s3-random-market-sample-report.json.sig","/verify/issuers/meridian/root-authority.json"],"final_policy_decision":"EXTERNAL_REQUIRED","summary":"Ordinary OrgAnchor URL verification passed for identity, integrity, and protocol conformance, and both evidence-artifact signatures and canonical hashes verify. The current Atlas assessment supports conformity only for eight issuer-selected factory units, while the current Meridian market sample reports four out-of-tolerance units among twelve independently acquired units from overlapping lots. Because both items are scope-limited and neither has been invalidated or reconciled, the conflict remains active, support is conflicted, and the population-wide claim truth is not determined. No fraud is established."}