{"scenario_id":"manufacturing-conflicting-current-evidence-v1","evaluation_time":"2026-07-17T00:00:00Z","identity_continuity":"VERIFIED","package_integrity":"PASS","package_health_status":"FRESH","conflict_status":"ACTIVE_CONFLICT","claim_support":"CONFLICTED","claim_truth":"NOT_DETERMINED","fraud_assessment":"NOT_ESTABLISHED","evidence_assessment":[{"evidence_id":"evidence-s2-current-conformity","s_class":"S2","provenance":"VERIFIED","freshness":"CURRENT","subject_scope":"MATCH","direction":"SUPPORTS","population_scope":"LIMITED","limitations":["Covers a reviewed process and eight issuer-selected units, not every unit released during the claim window.","Only lots NMC-260601 and NMC-260615 were observed.","Zero nonconforming units among eight is arithmetically consistent but insufficient to establish universal current-production conformity.","Issuer signature verifies artifact provenance, not real-world issuer identity, evidence sufficiency, or claim truth.","Does not invalidate later independent market observations."]},{"evidence_id":"evidence-s3-market-sample","s_class":"S3","provenance":"VERIFIED","freshness":"CURRENT","subject_scope":"MATCH","direction":"CONTRADICTS","population_scope":"LIMITED","limitations":["Twelve independently selected market units cannot establish a population-wide failure rate.","Four measurements are outside the inclusive 49.070–49.090 mm tolerance interval: 49.094, 49.096, 49.069, and 49.067 mm; the reported arithmetic is correct.","Sampling is limited to three distributors, two regions, and lots NMC-260601, NMC-260615, and NMC-260628.","Custody and product-credential checks are asserted, but their underlying records are not included in the fetched report.","Sampler signature verifies artifact provenance, not real-world issuer identity, measurement truth, fraud, or a procurement decision."]}],"conflict_analysis":{"same_subject":true,"overlapping_time_window":true,"resolution_status":"UNRESOLVED","why_not_resolved":["Both reports concern product model NMC-NA4908, the same dimensional specification, and production or acquisition within the claim window.","The reports overlap on lots NMC-260601 and NMC-260615 yet point in opposite directions.","The S2 assessment used eight issuer-selected factory units, while the S3 report used twelve independently acquired market units; neither bounded sample establishes the entire production population.","Valid signatures establish provenance of the reports but do not determine which measurements or population-level conclusion is true.","No withdrawal, correction, reconciliation, or sufficiently broad repeat study is present."]},"risk_gaps":["Underlying S2 unit measurements, measurement method, calibration records, and selection rationale are absent.","Underlying S3 acquisition, custody, product-authentication, unit-to-lot, measurement, and calibration records are absent.","Exact production and release dates for the sampled market units are not stated.","The package contains no organizational response, correction, or investigation reconciling the conflicting results.","Neither bounded sample supports a universal conclusion about all units released from 2026-06-01 through 2026-07-17."],"next_checks":[{"priority":1,"target_gaps":["S2_ISSUER_SCOPE_AND_METHOD"],"cost_level":"LOW","action":"Obtain the S2 unit-level measurements, sampling rationale, inspection procedure, instrument calibration, and lot records.","reason":"These existing records can test the supporting report's method and arithmetic without commissioning new sampling."},{"priority":2,"target_gaps":["S3_PROVENANCE_AND_CUSTODY"],"cost_level":"LOW","action":"Obtain the S3 acquisition receipts, custody log, product-credential evidence, unit-to-lot mapping, raw measurement records, method, and calibration records.","reason":"The report asserts custody and authentication, but reviewing the underlying records is the lowest-cost way to test whether the four contradictory measurements are attributable and reliable."},{"priority":3,"target_gaps":["SUBJECT_BATCH_AND_TIME_ALIGNMENT"],"cost_level":"LOW","action":"Confirm production and release dates for every sampled unit and reconcile the overlapping lots across both reports.","reason":"This determines whether each measurement directly falls within the claimed release population and whether nominally identical lots were sampled comparably."},{"priority":4,"target_gaps":["ORGANIZATION_RESPONSE_OR_CORRECTION"],"cost_level":"LOW","action":"Request Northstar's documented investigation, containment decision, and any correction or withdrawal addressing the S3 results.","reason":"An organization response may reconcile process changes, measurement differences, lot handling, or affected scope."},{"priority":5,"target_gaps":["BOUNDED_REPEAT_SAMPLING"],"cost_level":"MODERATE","action":"If records do not resolve the conflict, commission a preregistered independent repeat sample stratified across dates, lots, channels, and regions with documented custody and calibrated measurements.","reason":"Broader controlled sampling can reduce uncertainty without improperly treating either existing bounded sample as population-wide proof."}],"artifact_refs":["/verify/evidence-artifacts/s2-current-conformity-report.json","APC-NMC-2026-071","evidence-s2-current-conformity","/verify/evidence-artifacts/s3-random-market-sample-report.json","MRMS-NMC-2026-019","evidence-s3-market-sample"],"final_policy_decision":"EXTERNAL_REQUIRED","summary":"Ordinary verification passed with verified signatures for both current reports, but signature validity is not claim truth. The S2 report supports conformity only for a reviewed process and eight issuer-selected units, while the arithmetically correct S3 report finds four of twelve independently acquired units outside tolerance. Because the evidence concerns the same product, overlapping claim period, and overlapping lots but remains bounded and unreconciled, the conflict is active, claim support is conflicted, and claim truth is not determined."}