{"scenario_id":"manufacturing-conflicting-current-evidence-v1","evaluation_time":"2026-07-17T00:00:00Z","identity_continuity":"VERIFIED","package_integrity":"PASS","package_health_status":"FRESH","conflict_status":"ACTIVE_CONFLICT","claim_support":"CONFLICTED","claim_truth":"NOT_DETERMINED","fraud_assessment":"NOT_ESTABLISHED","evidence_assessment":[{"evidence_id":"evidence-s2-current-conformity","s_class":"S2","provenance":"NOT_VERIFIED","freshness":"CURRENT","subject_scope":"MATCH","direction":"SUPPORTS","population_scope":"LIMITED","limitations":["Atlas report APC-NMC-2026-071 covers a scheduled process assessment and eight issuer-selected units from lots NMC-260601 and NMC-260615, not every released unit.","The declared issuer route requires a manual issuer-backed signature or registry verification; package tooling records it only as S2_1.","The issuer was a paid certification service."]},{"evidence_id":"evidence-s3-market-sample","s_class":"S3","provenance":"NOT_VERIFIED","freshness":"CURRENT","subject_scope":"MATCH","direction":"CONTRADICTS","population_scope":"LIMITED","limitations":["Meridian report MRMS-NMC-2026-019 reports four of twelve market-purchased units outside the 49.070–49.090 mm tolerance: 49.094, 49.096, 49.069, and 49.067 mm.","It is limited to twelve units from three identified current lots and cannot establish a full-production failure rate.","Sampler signature, custody records, and raw measurement evidence remain to be independently rechecked."]}],"conflict_analysis":{"same_subject":true,"overlapping_time_window":true,"resolution_status":"UNRESOLVED","why_not_resolved":["Both artifacts address model NMC-NA4908, the same inner-diameter specification, and lots/time within the claim window, but have opposite results.","The eight-unit issuer-selected assessment cannot override the independently acquired twelve-unit market observation.","Neither bounded assessment establishes conformity or nonconformity for every unit released in the claim window."]},"risk_gaps":["Issuer-backed verification of the Atlas report is not completed.","Independent recheck of Meridian signature, custody, product credentials, raw measurements, and tolerance calculation is required.","No evidence resolves the conflict for all production released from 2026-06-01 through 2026-07-17.","No correction or supersession policy is published."],"next_checks":[{"priority":1,"target_gaps":["S2_ISSUER_SCOPE_AND_METHOD"],"cost_level":"LOW","action":"Verify Atlas report APC-NMC-2026-071 against an issuer-controlled registry or signature service; confirm its lots, eight-unit selection, method, and validity period.","reason":"This verifies the supporting artifact without expanding its limited scope."},{"priority":2,"target_gaps":["S3_PROVENANCE_AND_CUSTODY"],"cost_level":"LOW","action":"Verify Meridian report MRMS-NMC-2026-019 signature, custody records, product credentials, and raw measurement bundle; recompute tolerance against 49.070–49.090 mm.","reason":"This tests whether the conflicting sampled-unit observations are attributable and correctly calculated."},{"priority":3,"target_gaps":["SUBJECT_BATCH_AND_TIME_ALIGNMENT"],"cost_level":"LOW","action":"Obtain release and traceability records linking all sampled lots and assessed lots to the stated release interval.","reason":"It confirms the evidence applies to the decision window and identifies uncovered production."},{"priority":4,"target_gaps":["ORGANIZATION_RESPONSE_OR_CORRECTION"],"cost_level":"LOW","action":"Request Northstar's documented investigation, containment, and correction or supersession response to the four out-of-tolerance market units.","reason":"A response may explain or resolve the active conflict, but must be independently supported."},{"priority":5,"target_gaps":["BOUNDED_REPEAT_SAMPLING"],"cost_level":"MODERATE","action":"Commission independently controlled repeat market sampling across additional current lots after the low-cost checks.","reason":"Additional bounded evidence can reduce uncertainty but cannot be replaced by averaging the existing conflict."}],"artifact_refs":["verify/organchor.json","verify/claims/product-claims.json","verify/evidence/evidence-manifest.json","verify/evidence-artifacts/s2-current-conformity-report.json","verify/evidence-artifacts/s3-random-market-sample-report.json"],"final_policy_decision":"EXTERNAL_REQUIRED","summary":"The ordinary OrgAnchor URL verification passed for package integrity and organizational identity continuity. Current S2 evidence supports conformity only within an eight-unit assessed scope, while current S3 market evidence reports four out-of-tolerance units among twelve sampled units. The conflict is unresolved; the package does not sufficiently support the universal current-production claim, and it does not establish fraud or a population failure rate."}